{
  "$schema": "../../schemas/video-model.schema.json",
  "configId": "volcengine/seedance-2.0",
  "displayName": "Seedance 2.0",
  "modes": ["text", "first-frame", "first-last-frame", "reference"],
  "maxReferenceImages": 9,
  "maxReferenceVideos": 3,
  "maxReferenceAudios": 3,
  "maxReferenceDurationSeconds": 15,
  "supportsAudioOnlyReference": false,
  "resolutions": ["480p", "720p", "1080p", "4k"],
  "aspectRatios": ["adaptive", "16:9", "4:3", "1:1", "3:4", "9:16", "21:9"],
  "minDurationSeconds": 4,
  "maxDurationSeconds": 15,
  "supportsAutoDuration": true,
  "supportsAudio": true,
  "requiresAdaptiveFrameRatio": false
}
